{"origin": "Karachi", "destination": "Multan", "budget": 5500000.0, "dates": "2024-12-28", "transportation_type": "flight", "currency": "PKR", "number_of_people": "2", "transportation_budget": 0, "hotel_budget": 0, "activities_budget": 0, "plan_details": "\n\ud83c\udf1f Your Travel Plan:\n\ud83d\udc65 Number of Travelers: 2\n\ud83d\udcb0 Total Budget: 5500000.0 PKR\n\ud83d\ude8d Transportation Budget: 0 PKR\n\ud83c\udfe8 Hotels Budget: 0 PKR\n\ud83c\udfa1 Activities Budget: 0 PKR\n\n\ud83d\ude8d Transportation Options:\n1. Airblue Karachi to Multan Flights | Book Discounted Air Tickets\n   Link: https://www.sastaticket.pk/airline/airblue-karachi-to-multan-flights\n   Price: N/A\n\ud83d\ude8d Total Transportation Cost: 0 PKR\n\n\ud83c\udfe8 Hotels:\n1. The 10 BEST Hotels in Multan 2024 (From 3453 PKR) | Trip.com\n   Link: https://pk.trip.com/hotels/city/pk/multan.html\n   Price: N/A\n2. \ud835\udc01\ud835\udc2e\ud835\udc1d\ud835\udc20\ud835\udc1e\ud835\udc2d \ud835\udc07\ud835\udc28\ud835\udc2d\ud835\udc1e\ud835\udc25\ud835\udc2c in Multan @ 25% OFF - Best Budget Hotels to Stay | Great ...\n   Link: https://www.makemytrip.com/hotels-international/pakistan/multan-hotels/budget-hotels.html\n   Price: N/A\n3. 10 Best Multan Hotels, Pakistan (From $9) - Booking.com\n   Link: https://www.booking.com/city/pk/multan-pk.html\n   Price: N/A\n4. Mult\u0101n Hotels: 120 Cheap Mult\u0101n Hotel Deals\n   Link: https://www.hotelscombined.com/Place/Multan.htm\n   Price: N/A\n5. Multan Hotels Starting From USD23 - Compare 95 Hotels In Multan ... - Wego\n   Link: https://www.wego.com/hotels/pakistan/multan\n   Price: N/A\n\ud83c\udfe8 Total Hotel Cost: 0 PKR\n\n\ud83c\udfa1 Activities:\n1. Book Activities Tickets, Attractions in Multan, Pakistan\n   Link: https://www.gother.com/en-us/experiences/pakistan/multan\n   Price: N/A\n2. Things to do in Multan - 2024-25 | Apricot Tours\n   Link: https://www.apricottours.pk/things-to-do-in-multan/\n   Price: N/A\n3. What to do in Multan?: A Foreign Tourist's 1st Guide to this Saintly ...\n   Link: https://gypsytours.pk/travel-and-tourism/what-to-do-in-multan/\n   Price: N/A\n4. Multan Travel Guide (2024) - TravelFeed\n   Link: https://travelfeed.com/destinations/pakistan/Punjab/Multan\n   Price: N/A\n5. Explore Multan: Top 10 Things to Do in the City - tripjive.com\n   Link: https://tripjive.com/explore-multan-top-10-things-to-do-in-the-city/\n   Price: N/A\n\ud83c\udfa1 Total Activities Cost: 0 PKR\n"}
{"origin": "Karachi", "destination": "Multan", "budget": 5500000.0, "dates": "2024-12-28", "transportation_type": "flight", "currency": "PKR", "number_of_people": "2", "transportation_budget": 1650000.0, "hotel_budget": 1650000.0, "activities_budget": 2200000.0, "plan_details": "\n\ud83c\udf1f Your Travel Plan:\n\ud83d\udc65 Number of Travelers: 2\n\ud83d\udcb0 Total Budget: 5500000.0 PKR\n\ud83d\ude8d Transportation Budget: 1650000.0 PKR\n\ud83c\udfe8 Hotels Budget: 1650000.0 PKR\n\ud83c\udfa1 Activities Budget: 2200000.0 PKR\n\n\ud83d\ude8d Transportation Options:\n1. Airblue Karachi to Multan Flights | Book Discounted Air Tickets\n   Link: https://www.sastaticket.pk/airline/airblue-karachi-to-multan-flights\n   Price: N/A\n\ud83d\ude8d Total Transportation Cost: 0 PKR\n\n\ud83c\udfe8 Hotels:\n1. Best Places to Stay in Multan: Top Accommodation Options\n   Link: https://tripjive.com/best-places-to-stay-in-multan-top-accommodation-options/\n   Price: N/A\n2. \ud835\udc01\ud835\udc2e\ud835\udc1d\ud835\udc20\ud835\udc1e\ud835\udc2d \ud835\udc07\ud835\udc28\ud835\udc2d\ud835\udc1e\ud835\udc25\ud835\udc2c in Multan @ 25% OFF - Best Budget Hotels to Stay | Great ...\n   Link: https://www.makemytrip.com/hotels-international/pakistan/multan-hotels/budget-hotels.html\n   Price: N/A\n3. 10 Best Multan Hotels, Pakistan (From $9) - Booking.com\n   Link: https://www.booking.com/city/pk/multan-pk.html\n   Price: N/A\n4. THE 10 BEST Multan Hotel Deals (Dec 2024) - Tripadvisor\n   Link: https://www.tripadvisor.com/SmartDeals-g317117-Multan_Punjab_Province-Hotel-Deals.html\n   Price: N/A\n5. Mult\u0101n Hotels: 120 Cheap Mult\u0101n Hotel Deals\n   Link: https://www.hotelscombined.com/Place/Multan.htm\n   Price: N/A\n\ud83c\udfe8 Total Hotel Cost: 0 PKR\n\n\ud83c\udfa1 Activities:\n1. Book Activities Tickets, Attractions in Multan, Pakistan\n   Link: https://www.gother.com/en-us/experiences/pakistan/multan\n   Price: N/A\n2. Things to do in Multan - 2024-25 | Apricot Tours\n   Link: https://www.apricottours.pk/things-to-do-in-multan/\n   Price: N/A\n3. What to do in Multan?: A Foreign Tourist's 1st Guide to this Saintly ...\n   Link: https://gypsytours.pk/travel-and-tourism/what-to-do-in-multan/\n   Price: N/A\n4. Multan Travel Guide (2024) - TravelFeed\n   Link: https://travelfeed.com/destinations/pakistan/Punjab/Multan\n   Price: N/A\n5. Explore Multan: Top 10 Things to Do in the City - tripjive.com\n   Link: https://tripjive.com/explore-multan-top-10-things-to-do-in-the-city/\n   Price: N/A\n\ud83c\udfa1 Total Activities Cost: 0 PKR\n"}
{"origin": "Karachi", "destination": "Multan", "budget": 5500000.0, "dates": "2024-12-28", "transportation_type": "flight", "currency": "PKR", "number_of_people": "2", "transportation_budget": 1650000.0, "hotel_budget": 1650000.0, "activities_budget": 2200000.0, "plan_details": "\n\ud83c\udf1f Your Travel Plan:\n\ud83d\udc65 Number of Travelers: 2\n\ud83d\udcb0 Total Budget: 5500000.0 PKR\n\ud83d\ude8d Transportation Budget: 1650000.0 PKR\n\ud83c\udfe8 Hotels Budget: 1650000.0 PKR\n\ud83c\udfa1 Activities Budget: 2200000.0 PKR\n\n\ud83d\ude8d Transportation Options:\n1. No transportation options available\n   Link: N/A\n   Price: N/A\n\ud83d\ude8d Total Transportation Cost: 0 PKR\n\n\ud83c\udfe8 Hotels:\n1. The 10 BEST Hotels in Multan 2024 (From 3453 PKR) | Trip.com\n   Link: https://pk.trip.com/hotels/city/pk/multan.html\n   Price: N/A\n2. \ud835\udc01\ud835\udc2e\ud835\udc1d\ud835\udc20\ud835\udc1e\ud835\udc2d \ud835\udc07\ud835\udc28\ud835\udc2d\ud835\udc1e\ud835\udc25\ud835\udc2c in Multan @ 25% OFF - Best Budget Hotels to Stay | Great ...\n   Link: https://www.makemytrip.com/hotels-international/pakistan/multan-hotels/budget-hotels.html\n   Price: N/A\n3. 10 Best Multan Hotels, Pakistan (From $9) - Booking.com\n   Link: https://www.booking.com/city/pk/multan-pk.html\n   Price: N/A\n4. Mult\u0101n Hotels: 120 Cheap Mult\u0101n Hotel Deals\n   Link: https://www.hotelscombined.com/Place/Multan.htm\n   Price: N/A\n5. Multan Hotels Starting From USD23 - Compare 95 Hotels In Multan ... - Wego\n   Link: https://www.wego.com/hotels/pakistan/multan\n   Price: N/A\n\ud83c\udfe8 Total Hotel Cost: 0 PKR\n\n\ud83c\udfa1 Activities:\n1. Book Activities Tickets, Attractions in Multan, Pakistan\n   Link: https://www.gother.com/en-us/experiences/pakistan/multan\n   Price: N/A\n2. Multan Travel Guide: Top 25 Things to Do in Multan, Pakistan\n   Link: https://nomadicsamuel.com/city-guides/multan-travel-guide\n   Price: N/A\n3. Things to do in Multan - 2024-25 | Apricot Tours\n   Link: https://www.apricottours.pk/things-to-do-in-multan/\n   Price: N/A\n4. Multan Travel Guide (2024) - TravelFeed\n   Link: https://travelfeed.com/destinations/pakistan/Punjab/Multan\n   Price: N/A\n5. Explore Multan: Top 10 Things to Do in the City - tripjive.com\n   Link: https://tripjive.com/explore-multan-top-10-things-to-do-in-the-city/\n   Price: N/A\n\ud83c\udfa1 Total Activities Cost: 0 PKR\n"}
{"origin": "Karachi", "destination": "Lahore", "budget": 8250000.0, "dates": "2024-12-28", "transportation_type": "flight", "currency": "PKR", "number_of_people": "1", "transportation_budget": 3300000.0, "hotel_budget": 3300000.0, "activities_budget": 1650000.0, "plan_details": "\n\ud83c\udf1f Your Travel Plan:\n\ud83d\udc65 Number of Travelers: 1\n\ud83d\udcb0 Total Budget: 8250000.0 PKR\n\ud83d\ude8d Transportation Budget: 3300000.0 PKR\n\ud83c\udfe8 Hotels Budget: 3300000.0 PKR\n\ud83c\udfa1 Activities Budget: 1650000.0 PKR\n\n\ud83d\ude8d Transportation Options:\n1. Karachi to Lahore Flights, KHI to LHE Tickets Airfares @ Cleartrip ...\n   Link: https://www.cleartrip.ae/flight-schedule/karachi-lahore-flights.html\n   Price: N/A\n\ud83d\ude8d Total Transportation Cost: 0 PKR\n\n\ud83c\udfe8 Hotels:\n1. The Best Cheap Hotels in Lahore from $25 - Expedia\n   Link: https://www.expedia.com/Lahore-Hotels-Cheap-Hotels.0-0-d2068-tCheapHotels.Travel-Guide-Filter-Hotels\n   Price: N/A\n2. The 10 best cheap hotels in Lahore, Pakistan | Booking.com\n   Link: https://www.booking.com/budget/city/pk/lahore.en-gb.html\n   Price: N/A\n3. The 10 best cheap hotels in Lahore, Pakistan | Booking.com\n   Link: https://www.booking.com/budget/city/pk/lahore.html\n   Price: N/A\n4. 10 Top Hotels in Lahore | Places to Stay w/ 24/7 Friendly ... - Agoda\n   Link: https://www.agoda.com/en-in/city/lahore-pk.html\n   Price: N/A\n5. On a budget? Find Cheap Hotels in Lahore, Pakistan\n   Link: https://www.agoda.com/theme/cheap-hotels/city/lahore-pk.html\n   Price: N/A\n\ud83c\udfe8 Total Hotel Cost: 0 PKR\n\n\ud83c\udfa1 Activities:\n1. 10 Things to Do in Lahore: Top Activities & Attractions - MyTravelation.com\n   Link: https://mytravelation.com/lahore/\n   Price: N/A\n2. 15 Activities in Lahore, Pakistan (with Map and Images)\n   Link: https://visitsights.com/activities/Pakistan/Lahore\n   Price: N/A\n3. Top Things To Do In Lahore (Pakistan) In 2024 - 2025\n   Link: https://travelsetu.com/guide/lahore-tourism/things-to-do-in-lahore\n   Price: N/A\n4. 55 Things to do in Lahore - Pakistan Travel Blog\n   Link: https://www.pakistantravelblog.com/things-to-do-in-lahore/\n   Price: N/A\n5. 160 of the Best Things To Do in Lahore\n   Link: https://visitlahore.com/best-things-to-do-in-lahore/\n   Price: N/A\n\ud83c\udfa1 Total Activities Cost: 0 PKR\n"}
{"origin": "Karachi", "destination": "Islamabad", "budget": 13750000.0, "dates": "2024-12-29", "transportation_type": "flight", "currency": "PKR", "number_of_people": "2", "transportation_budget": 5500000.0, "hotel_budget": 5500000.0, "activities_budget": 2750000.0, "plan_details": "\n\ud83c\udf1f Your Travel Plan:\n\ud83d\udc65 Number of Travelers: 2\n\ud83d\udcb0 Total Budget: 13750000.0 PKR\n\ud83d\ude8d Transportation Budget: 5500000.0 PKR\n\ud83c\udfe8 Hotels Budget: 5500000.0 PKR\n\ud83c\udfa1 Activities Budget: 2750000.0 PKR\n\n\ud83d\ude8d Transportation Options:\n1. Cheap Air Tickets from Karachi to Islamabad | Save upto 25%\n   Link: https://www.sastaticket.pk/flights/cheap-flights-from-karachi-to-islamabad\n   Price: N/A\n2. Karachi to Islamabad Flights, KHI \ufe0eISB Cheap Ticket Prices\n   Link: https://bookme.pk/karachi-to-islamabad-flights\n   Price: N/A\n\ud83d\ude8d Total Transportation Cost: 0 PKR\n\n\ud83c\udfe8 Hotels:\n1. The Best Cheap Hotels in Islamabad - Book on Hotels.com\n   Link: https://www.hotels.com/de1642108-qu0/cheap-hotels-islamabad-pakistan/?siteid=310000033\n   Price: N/A\n2. The 10 best cheap hotels in Islamabad, Pakistan | Booking.com\n   Link: https://www.booking.com/budget/city/pk/islamabad.en-gb.html\n   Price: N/A\n3. The Best 10 Islamabad Hotels from $44 - Cheap Hotel Deals - Travelocity\n   Link: https://www.travelocity.com/Islamabad-Hotels.d6141508.Travel-Guide-Hotels\n   Price: N/A\n4. On a budget? Find Cheap Hotels in Islamabad, Pakistan\n   Link: https://www.agoda.com/theme/cheap-hotels/city/islamabad-pk.html\n   Price: N/A\n5. Best Top 30+ Islamabad Hotels on cheap rates | iMusafir.pk\n   Link: https://www.imusafir.pk/city/islamabad/\n   Price: N/A\n\ud83c\udfe8 Total Hotel Cost: 0 PKR\n\n\ud83c\udfa1 Activities:\n1. 17 Things to do in Islamabad - Islamabad Pakistan\n   Link: https://islamabadpk.com/things-to-do-in-islamabad/\n   Price: N/A\n2. 13 Activities in Islamabad, Pakistan (with Map and Images)\n   Link: https://visitsights.com/activities/Pakistan/Islamabad\n   Price: N/A\n3. Islamabad Activities - 70 Suggested Activities | Visit A City\n   Link: https://www.visitacity.com/en/islamabad/activities/private-sightseeing-tours\n   Price: N/A\n4. THE 10 BEST Islamabad Tours & Excursions - Tripadvisor\n   Link: https://www.tripadvisor.com/Attractions-g293960-Activities-c42-Islamabad_Islamabad_Capital_Territory.html\n   Price: N/A\n5. Explore Top 10 Things to Do in Islamabad - tripjive.com\n   Link: https://tripjive.com/explore-top-10-things-to-do-in-islamabad/\n   Price: N/A\n\ud83c\udfa1 Total Activities Cost: 0 PKR\n"}
{"origin": "Karachi", "destination": "Islamabad", "budget": 13750000.0, "dates": "2024-12-29", "transportation_type": "flight", "currency": "PKR", "number_of_people": "2", "transportation_budget": 5500000.0, "hotel_budget": 2750000.0, "activities_budget": 5500000.0, "plan_details": "\n\ud83c\udf1f Your Travel Plan:\n\ud83d\udc65 Number of Travelers: 2\n\ud83d\udcb0 Total Budget: 13750000.0 PKR\n\ud83d\ude8d Transportation Budget: 5500000.0 PKR\n\ud83c\udfe8 Hotels Budget: 2750000.0 PKR\n\ud83c\udfa1 Activities Budget: 5500000.0 PKR\n\n\ud83d\ude8d Transportation Options:\n1. Karachi to Islamabad Flights, KHI \ufe0eISB Cheap Ticket Prices\n   Link: https://bookme.pk/karachi-to-islamabad-flights\n   Price: N/A\n2. Cheap Air Tickets from Karachi to Islamabad | Save upto 25%\n   Link: https://www.sastaticket.pk/flights/cheap-flights-from-karachi-to-islamabad\n   Price: N/A\n\ud83d\ude8d Total Transportation Cost: 0 PKR\n\n\ud83c\udfe8 Hotels:\n1. The Best Cheap Hotels in Islamabad - Book on Hotels.com\n   Link: https://www.hotels.com/de1642108-qu0/cheap-hotels-islamabad-pakistan/?siteid=310000033\n   Price: N/A\n2. The 10 best cheap hotels in Islamabad, Pakistan | Booking.com\n   Link: https://www.booking.com/budget/city/pk/islamabad.en-gb.html\n   Price: N/A\n3. \ud835\udde7\ud835\udddb\ud835\uddd8 \ud835\udfed\ud835\udfec \ud835\uddd5\ud835\uddd8\ud835\udde6\ud835\udde7 Hotels in Islamabad of 2024 (with Prices)\n   Link: https://www.tripadvisor.in/Hotels-g293960-Islamabad_Islamabad_Capital_Territory-Hotels.html\n   Price: N/A\n4. On a budget? Find Cheap Hotels in Islamabad, Pakistan\n   Link: https://www.agoda.com/theme/cheap-hotels/city/islamabad-pk.html\n   Price: N/A\n5. Best Top 30+ Islamabad Hotels on cheap rates | iMusafir.pk\n   Link: https://www.imusafir.pk/city/islamabad/\n   Price: N/A\n\ud83c\udfe8 Total Hotel Cost: 0 PKR\n\n\ud83c\udfa1 Activities:\n1. Islamabad Activities - 106 Suggested Activities | Visit A City\n   Link: https://www.visitacity.com/en/islamabad/activities/all-activities\n   Price: N/A\n2. Explore Top 10 Things to Do in Islamabad - tripjive.com\n   Link: https://tripjive.com/explore-top-10-things-to-do-in-islamabad/\n   Price: N/A\n3. 17 Things to do in Islamabad - Islamabad Pakistan\n   Link: https://islamabadpk.com/things-to-do-in-islamabad/\n   Price: N/A\n4. Things to do in Islamabad - 2024-25 | Apricot Tours\n   Link: https://www.apricottours.pk/things-to-do-in-islamabad/\n   Price: N/A\n5. Top 10 Places to Visit in Islamabad and Surroundings: A Traveler's ...\n   Link: https://visitpakistan.co/discover/top-10-places-islamabad-and-surroundings/\n   Price: N/A\n\ud83c\udfa1 Total Activities Cost: 0 PKR\n"}
{"origin": "Karachi", "destination": "Saudia Arabia", "budget": 110000000.0, "dates": "2024-12-31", "transportation_type": "flight", "currency": "PKR", "number_of_people": "1", "transportation_budget": 44000000.0, "hotel_budget": 44000000.0, "activities_budget": 22000000.0, "plan_details": "\n\ud83c\udf1f Your Travel Plan:\n\ud83d\udc65 Number of Travelers: 1\n\ud83d\udcb0 Total Budget: 110000000.0 PKR\n\ud83d\ude8d Transportation Budget: 44000000.0 PKR\n\ud83c\udfe8 Hotels Budget: 44000000.0 PKR\n\ud83c\udfa1 Activities Budget: 22000000.0 PKR\n\n\ud83d\ude8d Transportation Options:\n1. Cheap Air Tickets from Karachi to Riyadh | Fares Upto 15% Off\n   Link: https://www.sastaticket.pk/flights/cheap-flights-from-karachi-to-riyadh\n   Price: N/A\n2. No More Options Available\n   Link: N/A\n   Price: N/A\n3. No More Options Available\n   Link: N/A\n   Price: N/A\n4. No More Options Available\n   Link: N/A\n   Price: N/A\n5. No More Options Available\n   Link: N/A\n   Price: N/A\n\ud83d\ude8d Total Transportation Cost: 0 PKR\n\n\ud83c\udfe8 Hotels:\n1. The Best Cheap Hotels in Saudi Arabia - Budget Your Trip\n   Link: https://www.budgetyourtrip.com/hotels/saudi-arabia-SA-t_budget\n   Price: N/A\n2. THE 10 BEST Budget Hotels in Saudi Arabia - Tripadvisor\n   Link: https://www.tripadvisor.co.uk/HotelsList-Saudi_Arabia-Cheap-Hotels-zfp7724518.html\n   Price: N/A\n3. Saudi Arabia Hotels: Cheap Hotels, Best Deals | sa.wego.com\n   Link: https://sa.wego.com/en/hotels/saudi-arabia\n   Price: N/A\n4. The 10 best cheap hotels in Saudi Arabia | Booking.com\n   Link: https://www.booking.com/budget/country/sa.html\n   Price: N/A\n5. Cheap Hotels in Saudi Arabia\n   Link: https://www.hotels.com/co10233150-qu0/cheap-hotels-in-saudi-arabia/\n   Price: N/A\n\ud83c\udfe8 Total Hotel Cost: 0 PKR\n\n\ud83c\udfa1 Activities:\n1. Activities in Saudi Arabia - Seekholidays.com\n   Link: https://www.seekholidays.com/saudi-arabia/things-to-do/activities/\n   Price: N/A\n2. Exploring Saudi Arabia: Top Attractions, Activities, and ... - Travelophia\n   Link: https://travelophia.com/blog/exploring-saudi-arabia-top-attractions-activities-budget-tips/\n   Price: N/A\n3. THE 30 BEST Places to Visit in Saudi Arabia (UPDATED 2024) - Tripadvisor\n   Link: https://www.tripadvisor.in/Attractions-g293991-Activities-Saudi_Arabia.html\n   Price: N/A\n4. 'Visit Saudi': Guide to Tourism and Entertainment in Saudi Arabia\n   Link: https://www.spa.gov.sa/en/N2086588\n   Price: N/A\n5. The BEST Saudi Arabia Tours and Things to Do in 2024 - FREE ...\n   Link: https://www.getyourguide.com/saudi-arabia-l169036/\n   Price: N/A\n\ud83c\udfa1 Total Activities Cost: 0 PKR\n"}
{"origin": "Karachi", "destination": "Saudia Arabia", "budget": 110000000.0, "dates": "2024-12-31", "transportation_type": "flight", "currency": "PKR", "number_of_people": "1", "transportation_budget": 33000000.0, "hotel_budget": 33000000.0, "activities_budget": 44000000.0, "plan_details": "\n\ud83c\udf1f Your Travel Plan:\n\ud83d\udc65 Number of Travelers: 1\n\ud83d\udcb0 Total Budget: 110000000.0 PKR\n\ud83d\ude8d Transportation Budget: 33000000.0 PKR\n\ud83c\udfe8 Hotels Budget: 33000000.0 PKR\n\ud83c\udfa1 Activities Budget: 44000000.0 PKR\n\n\ud83d\ude8d Transportation Options:\n1. No More Options Available\n   Link: N/A\n   Price: N/A\n2. No More Options Available\n   Link: N/A\n   Price: N/A\n3. No More Options Available\n   Link: N/A\n   Price: N/A\n4. No More Options Available\n   Link: N/A\n   Price: N/A\n5. No More Options Available\n   Link: N/A\n   Price: N/A\n\ud83d\ude8d Total Transportation Cost: 0 PKR\n\n\ud83c\udfe8 Hotels:\n1. The Best Cheap Hotels in Saudi Arabia - Budget Your Trip\n   Link: https://www.budgetyourtrip.com/hotels/saudi-arabia-SA-t_budget\n   Price: N/A\n2. Saudi Arabia Hotels: Cheap Hotels, Best Deals | sa.wego.com\n   Link: https://sa.wego.com/en/hotels/saudi-arabia\n   Price: N/A\n3. The 10 best cheap hotels in Saudi Arabia | Booking.com\n   Link: https://www.booking.com/budget/country/sa.html\n   Price: N/A\n4. Cheap Hotels in Saudi Arabia\n   Link: https://www.hotels.com/co10233150-qu0/cheap-hotels-in-saudi-arabia/\n   Price: N/A\n5. CHEAP Hotels in Saudi Arabia ($9 a Night!) Updated 2024 Promos - Agoda\n   Link: https://www.agoda.com/country/saudi-arabia.html\n   Price: N/A\n\ud83c\udfe8 Total Hotel Cost: 0 PKR\n\n\ud83c\udfa1 Activities:\n1. Activities in Saudi Arabia - Seekholidays.com\n   Link: https://www.seekholidays.com/saudi-arabia/things-to-do/activities/\n   Price: N/A\n2. The Best Things to Do in Saudi Arabia - Marriott\n   Link: https://www.emea.marriott.com/en/travel-tips/the-best-things-to-do-in-saudi-arabia\n   Price: N/A\n3. THE 10 BEST Things to Do in Saudi Arabia 2024 (with Photos) - Tripadvisor\n   Link: https://www.tripadvisor.ie/Attractions-g293991-Activities-Saudi_Arabia.html\n   Price: N/A\n4. THE 30 BEST Places to Visit in Saudi Arabia (UPDATED 2024) - Tripadvisor\n   Link: https://www.tripadvisor.in/Attractions-g293991-Activities-Saudi_Arabia.html\n   Price: N/A\n5. THE 15 BEST Things to Do in Saudi Arabia (2024) - Tripadvisor\n   Link: https://www.tripadvisor.com/Attractions-g293991-Activities-Saudi_Arabia.html\n   Price: N/A\n\ud83c\udfa1 Total Activities Cost: 0 PKR\n"}
{"origin": "Karachi", "destination": "Saudia Arabia", "budget": 110000000.0, "dates": "2024-12-31", "transportation_type": "flight", "currency": "PKR", "number_of_people": "1", "transportation_budget": 44000000.0, "hotel_budget": 22000000.0, "activities_budget": 44000000.0, "plan_details": "\n\ud83c\udf1f Your Travel Plan:\n\ud83d\udc65 Number of Travelers: 1\n\ud83d\udcb0 Total Budget: 110000000.0 PKR\n\ud83d\ude8d Transportation Budget: 44000000.0 PKR\n\ud83c\udfe8 Hotels Budget: 22000000.0 PKR\n\ud83c\udfa1 Activities Budget: 44000000.0 PKR\n\n\ud83d\ude8d Transportation Options:\n1. No More Options Available\n   Link: N/A\n   Price: N/A\n2. No More Options Available\n   Link: N/A\n   Price: N/A\n3. No More Options Available\n   Link: N/A\n   Price: N/A\n4. No More Options Available\n   Link: N/A\n   Price: N/A\n5. No More Options Available\n   Link: N/A\n   Price: N/A\n\ud83d\ude8d Total Transportation Cost: 0 PKR\n\n\ud83c\udfe8 Hotels:\n1. Saudi Arabia Hotels | The Best Hotels in Saudi Arabia from \u00a379 ...\n   Link: https://www.lastminute.com/hotels/sa_saudi-arabia\n   Price: N/A\n2. The Best Cheap Hotels in Saudi Arabia - Budget Your Trip\n   Link: https://www.budgetyourtrip.com/hotels/saudi-arabia-SA-t_budget\n   Price: N/A\n3. Saudi Arabia Hotels: Cheap Hotels, Best Deals | sa.wego.com\n   Link: https://sa.wego.com/en/hotels/saudi-arabia\n   Price: N/A\n4. The 10 best cheap hotels in Saudi Arabia | Booking.com\n   Link: https://www.booking.com/budget/country/sa.html\n   Price: N/A\n5. Cheap Hotels in Saudi Arabia\n   Link: https://www.hotels.com/co10233150-qu0/cheap-hotels-in-saudi-arabia/\n   Price: N/A\n\ud83c\udfe8 Total Hotel Cost: 0 PKR\n\n\ud83c\udfa1 Activities:\n1. Activities in Saudi Arabia - Seekholidays.com\n   Link: https://www.seekholidays.com/saudi-arabia/things-to-do/activities/\n   Price: N/A\n2. Best Things to Do in Saudi Arabia - bookmybooking.com\n   Link: https://www.bookmybooking.com/blogs/saudi-arabia/things-to-do-in-saudi-arabia\n   Price: N/A\n3. 9 Fun Things to Do Only in Saudi Arabia\n   Link: https://www.touristsaudiarabia.com/fun-things-to-do-only-in-saudi-arabia/\n   Price: N/A\n4. THE 10 BEST Things to Do in Saudi Arabia 2024 (with Photos) - Tripadvisor\n   Link: https://www.tripadvisor.com.sg/Attractions-g293991-Activities-Saudi_Arabia.html\n   Price: N/A\n5. THE 30 BEST Places to Visit in Saudi Arabia (UPDATED 2024) - Tripadvisor\n   Link: https://www.tripadvisor.in/Attractions-g293991-Activities-Saudi_Arabia.html\n   Price: N/A\n\ud83c\udfa1 Total Activities Cost: 0 PKR\n"}
{"origin": "Karachi", "destination": "Saudia Arabia", "budget": 110000000.0, "dates": "2024-12-31", "transportation_type": "flight", "currency": "PKR", "number_of_people": "1", "transportation_budget": 0, "hotel_budget": 0, "activities_budget": 0, "plan_details": "\n\ud83c\udf1f Your Travel Plan:\n\ud83d\udc65 Number of Travelers: 1\n\ud83d\udcb0 Total Budget: 110000000.0 PKR\n\ud83d\ude8d Transportation Budget: 0 PKR\n\ud83c\udfe8 Hotels Budget: 0 PKR\n\ud83c\udfa1 Activities Budget: 0 PKR\n\n\ud83d\ude8d Transportation Options:\n1. Cheap Air Tickets from Karachi to Riyadh | Fares Upto 15% Off\n   Link: https://www.sastaticket.pk/flights/cheap-flights-from-karachi-to-riyadh\n   Price: N/A\n2. No More Options Available\n   Link: N/A\n   Price: N/A\n3. No More Options Available\n   Link: N/A\n   Price: N/A\n4. No More Options Available\n   Link: N/A\n   Price: N/A\n5. No More Options Available\n   Link: N/A\n   Price: N/A\n\ud83d\ude8d Total Transportation Cost: 0 PKR\n\n\ud83c\udfe8 Hotels:\n1. The Best Cheap Hotels in Saudi Arabia - Budget Your Trip\n   Link: https://www.budgetyourtrip.com/hotels/saudi-arabia-SA-t_budget\n   Price: N/A\n2. THE 10 BEST Budget Hotels in Saudi Arabia - Tripadvisor\n   Link: https://www.tripadvisor.co.uk/HotelsList-Saudi_Arabia-Cheap-Hotels-o60-zfp7724518.html\n   Price: N/A\n3. Saudi Arabia Hotels: Cheap Hotels, Best Deals | sa.wego.com\n   Link: https://sa.wego.com/en/hotels/saudi-arabia\n   Price: N/A\n4. The 10 best cheap hotels in Saudi Arabia | Booking.com\n   Link: https://www.booking.com/budget/country/sa.html\n   Price: N/A\n5. Cheap Hotels in Saudi Arabia\n   Link: https://www.hotels.com/co10233150-qu0/cheap-hotels-in-saudi-arabia/\n   Price: N/A\n\ud83c\udfe8 Total Hotel Cost: 0 PKR\n\n\ud83c\udfa1 Activities:\n1. Activities in Saudi Arabia - Seekholidays.com\n   Link: https://www.seekholidays.com/saudi-arabia/things-to-do/activities/\n   Price: N/A\n2. Exploring Saudi Arabia: Top Attractions, Activities, and ... - Travelophia\n   Link: https://travelophia.com/blog/exploring-saudi-arabia-top-attractions-activities-budget-tips/\n   Price: N/A\n3. Best Things to Do in Saudi Arabia - bookmybooking.com\n   Link: https://www.bookmybooking.com/blogs/saudi-arabia/things-to-do-in-saudi-arabia\n   Price: N/A\n4. 9 Fun Things to Do Only in Saudi Arabia\n   Link: https://www.touristsaudiarabia.com/fun-things-to-do-only-in-saudi-arabia/\n   Price: N/A\n5. THE 30 BEST Places to Visit in Saudi Arabia (UPDATED 2024) - Tripadvisor\n   Link: https://www.tripadvisor.in/Attractions-g293991-Activities-Saudi_Arabia.html\n   Price: N/A\n\ud83c\udfa1 Total Activities Cost: 0 PKR\n"}
{"origin": "Karachi", "destination": "Saudia Arabia", "budget": 110000000.0, "dates": "2024-12-31", "transportation_type": "flight", "currency": "PKR", "number_of_people": "1", "transportation_budget": 0, "hotel_budget": 0, "activities_budget": 0, "plan_details": "\n\ud83c\udf1f Your Travel Plan:\n\ud83d\udc65 Number of Travelers: 1\n\ud83d\udcb0 Total Budget: 110000000.0 PKR\n\ud83d\ude8d Transportation Budget: 0 PKR\n\ud83c\udfe8 Hotels Budget: 0 PKR\n\ud83c\udfa1 Activities Budget: 0 PKR\n\n\ud83d\ude8d Transportation Options:\n1. Cheap Air Tickets from Karachi to Riyadh | Fares Upto 15% Off\n   Link: https://www.sastaticket.pk/flights/cheap-flights-from-karachi-to-riyadh\n   Price: N/A\n2. No More Options Available\n   Link: N/A\n   Price: N/A\n3. No More Options Available\n   Link: N/A\n   Price: N/A\n4. No More Options Available\n   Link: N/A\n   Price: N/A\n5. No More Options Available\n   Link: N/A\n   Price: N/A\n\ud83d\ude8d Total Transportation Cost: 0 PKR\n\n\ud83c\udfe8 Hotels:\n1. Saudi Arabia Hotels | The Best Hotels in Saudi Arabia from \u00a379 ...\n   Link: https://www.lastminute.com/hotels/sa_saudi-arabia\n   Price: N/A\n2. The Best Cheap Hotels in Saudi Arabia - Budget Your Trip\n   Link: https://www.budgetyourtrip.com/hotels/saudi-arabia-SA-t_budget\n   Price: N/A\n3. Saudi Arabia Hotels: Cheap Hotels, Best Deals | sa.wego.com\n   Link: https://sa.wego.com/en/hotels/saudi-arabia\n   Price: N/A\n4. The 10 best cheap hotels in Saudi Arabia | Booking.com\n   Link: https://www.booking.com/budget/country/sa.html\n   Price: N/A\n5. Cheap Hotels in Saudi Arabia\n   Link: https://www.hotels.com/co10233150-qu0/cheap-hotels-in-saudi-arabia/\n   Price: N/A\n\ud83c\udfe8 Total Hotel Cost: 0 PKR\n\n\ud83c\udfa1 Activities:\n1. Activities in Saudi Arabia - Seekholidays.com\n   Link: https://www.seekholidays.com/saudi-arabia/things-to-do/activities/\n   Price: N/A\n2. Best Things to Do in Saudi Arabia - bookmybooking.com\n   Link: https://www.bookmybooking.com/blogs/saudi-arabia/things-to-do-in-saudi-arabia\n   Price: N/A\n3. 9 Fun Things to Do Only in Saudi Arabia\n   Link: https://www.touristsaudiarabia.com/fun-things-to-do-only-in-saudi-arabia/\n   Price: N/A\n4. THE 30 BEST Places to Visit in Saudi Arabia (UPDATED 2024) - Tripadvisor\n   Link: https://www.tripadvisor.in/Attractions-g293991-Activities-Saudi_Arabia.html\n   Price: N/A\n5. THE 15 BEST Things to Do in Saudi Arabia (2024) - Tripadvisor\n   Link: https://www.tripadvisor.com/Attractions-g293991-Activities-Saudi_Arabia.html\n   Price: N/A\n\ud83c\udfa1 Total Activities Cost: 0 PKR\n"}
{"origin": "Karachi", "destination": "Saudia Arabia", "budget": 110000000.0, "dates": "2024-12-31", "transportation_type": "flight", "currency": "PKR", "number_of_people": "1", "transportation_budget": 0, "hotel_budget": 0, "activities_budget": 0, "plan_details": "\n\ud83c\udf1f Your Travel Plan:\n\ud83d\udc65 Number of Travelers: 1\n\ud83d\udcb0 Total Budget: 110000000.0 PKR\n\ud83d\ude8d Transportation Budget: 0 PKR\n\ud83c\udfe8 Hotels Budget: 0 PKR\n\ud83c\udfa1 Activities Budget: 0 PKR\n\n\ud83d\ude8d Transportation Options:\n1. Cheap Air Tickets from Karachi to Riyadh | Fares Upto 15% Off\n   Link: https://www.sastaticket.pk/flights/cheap-flights-from-karachi-to-riyadh\n   Price: N/A\n2. No More Options Available\n   Link: N/A\n   Price: N/A\n3. No More Options Available\n   Link: N/A\n   Price: N/A\n4. No More Options Available\n   Link: N/A\n   Price: N/A\n5. No More Options Available\n   Link: N/A\n   Price: N/A\n\ud83d\ude8d Total Transportation Cost: 0 PKR\n\n\ud83c\udfe8 Hotels:\n1. The Best Cheap Hotels in Saudi Arabia - Budget Your Trip\n   Link: https://www.budgetyourtrip.com/hotels/saudi-arabia-SA-t_budget\n   Price: N/A\n2. Saudi Arabia Hotels: Cheap Hotels, Best Deals | sa.wego.com\n   Link: https://sa.wego.com/en/hotels/saudi-arabia\n   Price: N/A\n3. The 10 best cheap hotels in Saudi Arabia | Booking.com\n   Link: https://www.booking.com/budget/country/sa.html\n   Price: N/A\n4. THE 10 BEST Discount Hotels in Saudi Arabia - Tripadvisor\n   Link: https://www.tripadvisor.ca/HotelsList-Saudi_Arabia-Cheap-Hotels-zfp7724516.html\n   Price: N/A\n5. Cheap Hotels in Saudi Arabia\n   Link: https://www.hotels.com/co10233150-qu0/cheap-hotels-in-saudi-arabia/\n   Price: N/A\n\ud83c\udfe8 Total Hotel Cost: 0 PKR\n\n\ud83c\udfa1 Activities:\n1. Activities in Saudi Arabia - Seekholidays.com\n   Link: https://www.seekholidays.com/saudi-arabia/things-to-do/activities/\n   Price: N/A\n2. Best Things to Do in Saudi Arabia - bookmybooking.com\n   Link: https://www.bookmybooking.com/blogs/saudi-arabia/things-to-do-in-saudi-arabia\n   Price: N/A\n3. Exploring Saudi Arabia: Top Attractions, Activities, and ... - Travelophia\n   Link: https://travelophia.com/blog/exploring-saudi-arabia-top-attractions-activities-budget-tips/\n   Price: N/A\n4. 9 Fun Things to Do Only in Saudi Arabia\n   Link: https://www.touristsaudiarabia.com/fun-things-to-do-only-in-saudi-arabia/\n   Price: N/A\n5. THE 30 BEST Places to Visit in Saudi Arabia (UPDATED 2024) - Tripadvisor\n   Link: https://www.tripadvisor.in/Attractions-g293991-Activities-Saudi_Arabia.html\n   Price: N/A\n\ud83c\udfa1 Total Activities Cost: 0 PKR\n"}
{"origin": "Karachi", "destination": "Multan", "budget": 110000000.0, "dates": "2024-12-31", "transportation_type": "flight", "currency": "PKR", "number_of_people": "1", "transportation_budget": 0, "hotel_budget": 0, "activities_budget": 0, "plan_details": "\n\ud83c\udf1f Your Travel Plan:\n\ud83d\udc65 Number of Travelers: 1\n\ud83d\udcb0 Total Budget: 110000000.0 PKR\n\ud83d\ude8d Transportation Budget: 0 PKR\n\ud83c\udfe8 Hotels Budget: 0 PKR\n\ud83c\udfa1 Activities Budget: 0 PKR\n\n\ud83d\ude8d Transportation Options:\n1. No More Options Available\n   Link: N/A\n   Price: N/A\n2. No More Options Available\n   Link: N/A\n   Price: N/A\n3. No More Options Available\n   Link: N/A\n   Price: N/A\n4. No More Options Available\n   Link: N/A\n   Price: N/A\n5. No More Options Available\n   Link: N/A\n   Price: N/A\n\ud83d\ude8d Total Transportation Cost: 0 PKR\n\n\ud83c\udfe8 Hotels:\n1. Best Places to Stay in Multan: Top Accommodation Options\n   Link: https://tripjive.com/best-places-to-stay-in-multan-top-accommodation-options/\n   Price: N/A\n2. The 10 BEST Hotels in Multan 2024 (From 3453 PKR) | Trip.com\n   Link: https://pk.trip.com/hotels/city/pk/multan.html\n   Price: N/A\n3. \ud835\udc01\ud835\udc2e\ud835\udc1d\ud835\udc20\ud835\udc1e\ud835\udc2d \ud835\udc07\ud835\udc28\ud835\udc2d\ud835\udc1e\ud835\udc25\ud835\udc2c in Multan @ 25% OFF - Best Budget Hotels to Stay | Great ...\n   Link: https://www.makemytrip.com/hotels-international/pakistan/multan-hotels/budget-hotels.html\n   Price: N/A\n4. Mult\u0101n Hotels: 120 Cheap Mult\u0101n Hotel Deals\n   Link: https://www.hotelscombined.com/Place/Multan.htm\n   Price: N/A\n5. \ud835\udde7\ud835\udddb\ud835\uddd8 \ud835\udfed\ud835\udfec \ud835\uddd5\ud835\uddd8\ud835\udde6\ud835\udde7 Hotels in Multan of 2024 (with Prices)\n   Link: https://www.tripadvisor.in/Hotels-g317117-Multan_Punjab_Province-Hotels.html\n   Price: N/A\n\ud83c\udfe8 Total Hotel Cost: 0 PKR\n\n\ud83c\udfa1 Activities:\n1. Book Activities Tickets, Attractions in Multan, Pakistan\n   Link: https://www.gother.com/en-us/experiences/pakistan/multan\n   Price: N/A\n2. Multan Travel Guide: Top 25 Things to Do in Multan, Pakistan\n   Link: https://nomadicsamuel.com/city-guides/multan-travel-guide\n   Price: N/A\n3. Things to do in Multan - 2024-25 | Apricot Tours\n   Link: https://www.apricottours.pk/things-to-do-in-multan/\n   Price: N/A\n4. Multan Travel Guide (2024) - TravelFeed\n   Link: https://travelfeed.com/destinations/pakistan/Punjab/Multan\n   Price: N/A\n5. Explore Multan: Top 10 Things to Do in the City - tripjive.com\n   Link: https://tripjive.com/explore-multan-top-10-things-to-do-in-the-city/\n   Price: N/A\n\ud83c\udfa1 Total Activities Cost: 0 PKR\n"}
{"origin": "Karachi", "destination": "Multan", "budget": 110000000.0, "dates": "2024-12-31", "transportation_type": "flight", "currency": "PKR", "number_of_people": "1", "transportation_budget": 44000000.0, "hotel_budget": 22000000.0, "activities_budget": 44000000.0, "plan_details": "\n\ud83c\udf1f Your Travel Plan:\n\ud83d\udc65 Number of Travelers: 1\n\ud83d\udcb0 Total Budget: 110000000.0 PKR\n\ud83d\ude8d Transportation Budget: 44000000.0 PKR\n\ud83c\udfe8 Hotels Budget: 22000000.0 PKR\n\ud83c\udfa1 Activities Budget: 44000000.0 PKR\n\n\ud83d\ude8d Transportation Options:\n1. No More Options Available\n   Link: N/A\n   Price: N/A\n2. No More Options Available\n   Link: N/A\n   Price: N/A\n3. No More Options Available\n   Link: N/A\n   Price: N/A\n4. No More Options Available\n   Link: N/A\n   Price: N/A\n5. No More Options Available\n   Link: N/A\n   Price: N/A\n\ud83d\ude8d Total Transportation Cost: 0 PKR\n\n\ud83c\udfe8 Hotels:\n1. Best Places to Stay in Multan: Top Accommodation Options\n   Link: https://tripjive.com/best-places-to-stay-in-multan-top-accommodation-options/\n   Price: N/A\n2. The 10 BEST Hotels in Multan 2024 (From 3453 PKR) | Trip.com\n   Link: https://pk.trip.com/hotels/city/pk/multan.html\n   Price: N/A\n3. \ud835\udc01\ud835\udc2e\ud835\udc1d\ud835\udc20\ud835\udc1e\ud835\udc2d \ud835\udc07\ud835\udc28\ud835\udc2d\ud835\udc1e\ud835\udc25\ud835\udc2c in Multan @ 25% OFF - Best Budget Hotels to Stay | Great ...\n   Link: https://www.makemytrip.com/hotels-international/pakistan/multan-hotels/budget-hotels.html\n   Price: N/A\n4. THE 10 BEST Multan Hotel Deals (Dec 2024) - Tripadvisor\n   Link: https://www.tripadvisor.com/SmartDeals-g317117-Multan_Punjab_Province-Hotel-Deals.html\n   Price: N/A\n5. Mult\u0101n Hotels: 120 Cheap Mult\u0101n Hotel Deals\n   Link: https://www.hotelscombined.com/Place/Multan.htm\n   Price: N/A\n\ud83c\udfe8 Total Hotel Cost: 0 PKR\n\n\ud83c\udfa1 Activities:\n1. Book Activities Tickets, Attractions in Multan, Pakistan\n   Link: https://www.gother.com/en-us/experiences/pakistan/multan\n   Price: N/A\n2. Multan Travel Guide: Top 25 Things to Do in Multan, Pakistan\n   Link: https://nomadicsamuel.com/city-guides/multan-travel-guide\n   Price: N/A\n3. Things to do in Multan - 2024-25 | Apricot Tours\n   Link: https://www.apricottours.pk/things-to-do-in-multan/\n   Price: N/A\n4. Multan Travel Guide (2024) - TravelFeed\n   Link: https://travelfeed.com/destinations/pakistan/Punjab/Multan\n   Price: N/A\n5. Explore Multan: Top 10 Things to Do in the City - tripjive.com\n   Link: https://tripjive.com/explore-multan-top-10-things-to-do-in-the-city/\n   Price: N/A\n\ud83c\udfa1 Total Activities Cost: 0 PKR\n"}
{"origin": "Karachi", "destination": "Multan", "budget": 110000000.0, "dates": "2024-12-31", "transportation_type": "flight", "currency": "PKR", "number_of_people": "1", "transportation_budget": 44000000.0, "hotel_budget": 22000000.0, "activities_budget": 44000000.0, "plan_details": "\n\ud83c\udf1f Your Travel Plan:\n\ud83d\udc65 Number of Travelers: 1\n\ud83d\udcb0 Total Budget: 110000000.0 PKR\n\ud83d\ude8d Transportation Budget: 44000000.0 PKR\n\ud83c\udfe8 Hotels Budget: 22000000.0 PKR\n\ud83c\udfa1 Activities Budget: 44000000.0 PKR\n\n\ud83d\ude8d Transportation Options:\n1. Airblue Karachi to Multan Flights | Book Discounted Air Tickets\n   Link: https://www.sastaticket.pk/airline/airblue-karachi-to-multan-flights\n   Price: N/A\n2. No More Options Available\n   Link: N/A\n   Price: N/A\n3. No More Options Available\n   Link: N/A\n   Price: N/A\n4. No More Options Available\n   Link: N/A\n   Price: N/A\n5. No More Options Available\n   Link: N/A\n   Price: N/A\n\ud83d\ude8d Total Transportation Cost: 0 PKR\n\n\ud83c\udfe8 Hotels:\n1. Best Places to Stay in Multan: Top Accommodation Options\n   Link: https://tripjive.com/best-places-to-stay-in-multan-top-accommodation-options/\n   Price: N/A\n2. \ud835\udc01\ud835\udc2e\ud835\udc1d\ud835\udc20\ud835\udc1e\ud835\udc2d \ud835\udc07\ud835\udc28\ud835\udc2d\ud835\udc1e\ud835\udc25\ud835\udc2c in Multan @ 25% OFF - Best Budget Hotels to Stay | Great ...\n   Link: https://www.makemytrip.com/hotels-international/pakistan/multan-hotels/budget-hotels.html\n   Price: N/A\n3. THE 10 BEST Multan Hotel Deals (Dec 2024) - Tripadvisor\n   Link: https://www.tripadvisor.com/SmartDeals-g317117-Multan_Punjab_Province-Hotel-Deals.html\n   Price: N/A\n4. Mult\u0101n Hotels: 120 Cheap Mult\u0101n Hotel Deals\n   Link: https://www.hotelscombined.com/Place/Multan.htm\n   Price: N/A\n5. 10 Top Hotels in Multan | Places to Stay w/ 24/7 Friendly ... - Agoda\n   Link: https://www.agoda.com/en-in/city/multan-pk.html\n   Price: N/A\n\ud83c\udfe8 Total Hotel Cost: 0 PKR\n\n\ud83c\udfa1 Activities:\n1. Book Activities Tickets, Attractions in Multan, Pakistan\n   Link: https://www.gother.com/en-us/experiences/pakistan/multan\n   Price: N/A\n2. What to do in Multan?: A Foreign Tourist's 1st Guide to this Saintly ...\n   Link: https://gypsytours.pk/travel-and-tourism/what-to-do-in-multan/\n   Price: N/A\n3. Things to do in Multan - 2024-25 | Apricot Tours\n   Link: https://www.apricottours.pk/things-to-do-in-multan/\n   Price: N/A\n4. Multan Travel Guide (2024) - TravelFeed\n   Link: https://travelfeed.com/destinations/pakistan/Punjab/Multan\n   Price: N/A\n5. Explore Multan: Top 10 Things to Do in the City - tripjive.com\n   Link: https://tripjive.com/explore-multan-top-10-things-to-do-in-the-city/\n   Price: N/A\n\ud83c\udfa1 Total Activities Cost: 0 PKR\n"}
{"origin": "Karachi", "destination": "Multan", "budget": 27500000.0, "dates": "2024-12-31", "transportation_type": "flight", "currency": "PKR", "number_of_people": "2", "transportation_budget": 11000000.0, "hotel_budget": 5500000.0, "activities_budget": 11000000.0, "plan_details": "\n\ud83c\udf1f Your Travel Plan:\n\ud83d\udc65 Number of Travelers: 2\n\ud83d\udcb0 Total Budget: 27500000.0 PKR\n\ud83d\ude8d Transportation Budget: 11000000.0 PKR\n\ud83c\udfe8 Hotels Budget: 5500000.0 PKR\n\ud83c\udfa1 Activities Budget: 11000000.0 PKR\n\n\ud83d\ude8d Transportation Options:\n1. No More Options Available\n   Link: N/A\n   Price: N/A\n2. No More Options Available\n   Link: N/A\n   Price: N/A\n3. No More Options Available\n   Link: N/A\n   Price: N/A\n4. No More Options Available\n   Link: N/A\n   Price: N/A\n5. No More Options Available\n   Link: N/A\n   Price: N/A\n\ud83d\ude8d Total Transportation Cost: 0 PKR\n\n\ud83c\udfe8 Hotels:\n1. \ud835\udc01\ud835\udc2e\ud835\udc1d\ud835\udc20\ud835\udc1e\ud835\udc2d \ud835\udc07\ud835\udc28\ud835\udc2d\ud835\udc1e\ud835\udc25\ud835\udc2c in Multan @ 25% OFF - Best Budget Hotels to Stay | Great ...\n   Link: https://www.makemytrip.com/hotels-international/pakistan/multan-hotels/budget-hotels.html\n   Price: N/A\n2. THE 10 BEST Multan Hotel Deals (Dec 2024) - Tripadvisor\n   Link: https://www.tripadvisor.com/SmartDeals-g317117-Multan_Punjab_Province-Hotel-Deals.html\n   Price: N/A\n3. Hotels in Mult\u0101n from $10 - Find Cheap Hotels with momondo\n   Link: https://www.momondo.com/hotels/multan\n   Price: N/A\n4. 10 Best Multan Hotels, Pakistan (From $12) - Booking.com\n   Link: https://www.booking.com/searchresults.html?dest_id=-2769709&dest_type=city\n   Price: N/A\n5. Mult\u0101n Hotels: 120 Cheap Mult\u0101n Hotel Deals\n   Link: https://www.hotelscombined.com/Place/Multan.htm\n   Price: N/A\n\ud83c\udfe8 Total Hotel Cost: 0 PKR\n\n\ud83c\udfa1 Activities:\n1. Book Activities Tickets, Attractions in Multan, Pakistan\n   Link: https://www.gother.com/en-us/experiences/pakistan/multan\n   Price: N/A\n2. Multan Travel Guide: Top 25 Things to Do in Multan, Pakistan\n   Link: https://nomadicsamuel.com/city-guides/multan-travel-guide\n   Price: N/A\n3. What to do in Multan?: A Foreign Tourist's 1st Guide to this Saintly ...\n   Link: https://gypsytours.pk/travel-and-tourism/what-to-do-in-multan/\n   Price: N/A\n4. Things to do in Multan - 2024-25 | Apricot Tours\n   Link: https://www.apricottours.pk/things-to-do-in-multan/\n   Price: N/A\n5. Multan Travel Guide (2024) - TravelFeed\n   Link: https://travelfeed.com/destinations/pakistan/Punjab/Multan\n   Price: N/A\n\ud83c\udfa1 Total Activities Cost: 0 PKR\n"}
{"origin": "Karachi", "destination": "Multan", "budget": 27500000.0, "dates": "2024-12-31", "transportation_type": "flight", "currency": "PKR", "number_of_people": "2", "transportation_budget": 27500000.0, "hotel_budget": 0.0, "activities_budget": 0.0, "plan_details": "\n\ud83c\udf1f Your Travel Plan:\n\ud83d\udc65 Number of Travelers: 2\n\ud83d\udcb0 Total Budget: 27500000.0 PKR\n\ud83d\ude8d Transportation Budget: 27500000.0 PKR\n\ud83c\udfe8 Hotels Budget: 0.0 PKR\n\ud83c\udfa1 Activities Budget: 0.0 PKR\n\n\ud83d\ude8d Transportation Options:\n1. No More Options Available\n   Link: N/A\n   Price: N/A\n2. No More Options Available\n   Link: N/A\n   Price: N/A\n3. No More Options Available\n   Link: N/A\n   Price: N/A\n4. No More Options Available\n   Link: N/A\n   Price: N/A\n5. No More Options Available\n   Link: N/A\n   Price: N/A\n\ud83d\ude8d Total Transportation Cost: 0 PKR\n\n\ud83c\udfe8 Hotels:\n1. Best Places to Stay in Multan: Top Accommodation Options\n   Link: https://tripjive.com/best-places-to-stay-in-multan-top-accommodation-options/\n   Price: N/A\n2. The 10 BEST Hotels in Multan 2024 (From 3453 PKR) | Trip.com\n   Link: https://pk.trip.com/hotels/city/pk/multan.html\n   Price: N/A\n3. \ud835\udc01\ud835\udc2e\ud835\udc1d\ud835\udc20\ud835\udc1e\ud835\udc2d \ud835\udc07\ud835\udc28\ud835\udc2d\ud835\udc1e\ud835\udc25\ud835\udc2c in Multan @ 25% OFF - Best Budget Hotels to Stay | Great ...\n   Link: https://www.makemytrip.com/hotels-international/pakistan/multan-hotels/budget-hotels.html\n   Price: N/A\n4. THE 10 BEST Multan Hotel Deals (Dec 2024) - Tripadvisor\n   Link: https://www.tripadvisor.com/SmartDeals-g317117-Multan_Punjab_Province-Hotel-Deals.html\n   Price: N/A\n5. Mult\u0101n Hotels: 120 Cheap Mult\u0101n Hotel Deals\n   Link: https://www.hotelscombined.com/Place/Multan.htm\n   Price: N/A\n\ud83c\udfe8 Total Hotel Cost: 0 PKR\n\n\ud83c\udfa1 Activities:\n1. Book Activities Tickets, Attractions in Multan, Pakistan\n   Link: https://www.gother.com/en-us/experiences/pakistan/multan\n   Price: N/A\n2. What to do in Multan?: A Foreign Tourist's 1st Guide to this Saintly ...\n   Link: https://gypsytours.pk/travel-and-tourism/what-to-do-in-multan/\n   Price: N/A\n3. Things to do in Multan - 2024-25 | Apricot Tours\n   Link: https://www.apricottours.pk/things-to-do-in-multan/\n   Price: N/A\n4. Multan Travel Guide (2024) - TravelFeed\n   Link: https://travelfeed.com/destinations/pakistan/Punjab/Multan\n   Price: N/A\n5. Explore Multan: Top 10 Things to Do in the City - tripjive.com\n   Link: https://tripjive.com/explore-multan-top-10-things-to-do-in-the-city/\n   Price: N/A\n\ud83c\udfa1 Total Activities Cost: 0 PKR\n"}
{"origin": "Karachi", "destination": "Multan", "budget": 27500000.0, "dates": "2024-12-31", "transportation_type": "flight", "currency": "PKR", "number_of_people": "2", "transportation_budget": 0, "hotel_budget": 0, "activities_budget": 0, "plan_details": "\n\ud83c\udf1f Your Travel Plan:\n\ud83d\udc65 Number of Travelers: 2\n\ud83d\udcb0 Total Budget: 27500000.0 PKR\n\ud83d\ude8d Transportation Budget: 0 PKR\n\ud83c\udfe8 Hotels Budget: 0 PKR\n\ud83c\udfa1 Activities Budget: 0 PKR\n\n\ud83d\ude8d Transportation Options:\n1. No More Options Available\n   Link: N/A\n   Price: N/A\n2. No More Options Available\n   Link: N/A\n   Price: N/A\n3. No More Options Available\n   Link: N/A\n   Price: N/A\n4. No More Options Available\n   Link: N/A\n   Price: N/A\n5. No More Options Available\n   Link: N/A\n   Price: N/A\n\ud83d\ude8d Total Transportation Cost: 0 PKR\n\n\ud83c\udfe8 Hotels:\n1. \ud835\udc01\ud835\udc2e\ud835\udc1d\ud835\udc20\ud835\udc1e\ud835\udc2d \ud835\udc07\ud835\udc28\ud835\udc2d\ud835\udc1e\ud835\udc25\ud835\udc2c in Multan @ 25% OFF - Best Budget Hotels to Stay | Great ...\n   Link: https://www.makemytrip.com/hotels-international/pakistan/multan-hotels/budget-hotels.html\n   Price: N/A\n2. THE 10 BEST Multan Hotel Deals (Dec 2024) - Tripadvisor\n   Link: https://www.tripadvisor.com/SmartDeals-g317117-Multan_Punjab_Province-Hotel-Deals.html\n   Price: N/A\n3. Hotels in Mult\u0101n from $10 - Find Cheap Hotels with momondo\n   Link: https://www.momondo.com/hotels/multan\n   Price: N/A\n4. 10 Best Multan Hotels, Pakistan (From $12) - Booking.com\n   Link: https://www.booking.com/searchresults.html?dest_id=-2769709&dest_type=city\n   Price: N/A\n5. Mult\u0101n Hotels: 120 Cheap Mult\u0101n Hotel Deals\n   Link: https://www.hotelscombined.com/Place/Multan.htm\n   Price: N/A\n\ud83c\udfe8 Total Hotel Cost: 0 PKR\n\n\ud83c\udfa1 Activities:\n1. Multan Travel Guide: Top 25 Things to Do in Multan, Pakistan\n   Link: https://nomadicsamuel.com/city-guides/multan-travel-guide\n   Price: N/A\n2. What to do in Multan?: A Foreign Tourist's 1st Guide to this Saintly ...\n   Link: https://gypsytours.pk/travel-and-tourism/what-to-do-in-multan/\n   Price: N/A\n3. Things to do in Multan - 2024-25 | Apricot Tours\n   Link: https://www.apricottours.pk/things-to-do-in-multan/\n   Price: N/A\n4. Multan Travel Guide (2024) - TravelFeed\n   Link: https://travelfeed.com/destinations/pakistan/Punjab/Multan\n   Price: N/A\n5. Explore Multan: Top 10 Things to Do in the City - tripjive.com\n   Link: https://tripjive.com/explore-multan-top-10-things-to-do-in-the-city/\n   Price: N/A\n\ud83c\udfa1 Total Activities Cost: 0 PKR\n"}
